"";"id";"text";"title";"abstract";"keywords";"methods";"type";"authors";"affiliation";"source";"year";"volume";"issue";"startpage";"endpage";"doi";"language";"database"
"61";"Han_2017_Sust.Swi";"The process of technology commercialization involves numerous hurdles, from the original idea to its translation into the market. Patenting brings to light the research activities created through university-industry collaborations. This paper explores patent propensity, as related to commercializing innovative activities resulting from collaborations between universities and regional small and medium enterprises (SMEs). To achieve our aims, we apply a robust regression analysis to test five research hypotheses using firm-level data on 263 firms located in the Gwangju region of Korea. Our empirical results show that certain industry characteristics are negatively related to the propensity to patent. In addition, and contrary to expectations, it is found that the InnoBiz firms that the government designated as innovative SMEs are not performing any differently from general firms. It is only the CEO's academic credentials that are found to be positively related to propensity to patent. From the findings, we can conclude that patenting propensity is likely related to CEOs' managerial strategies rather than the particular characteristics of the technology in question. We also suggest new technology commercialization related with universities' policies and support to promote regional SMEs including conglomerated firms as well as universities. 2017 by the author. Patent propensity and Regional SMEs and Technology transfer and commercialization and University-industry collaboration and commercialization and data set and government and industrial development and industrial enterprise and industrial policy and industrial practice and innovation and intellectual property rights and knowledge and regional pattern and regression analysis and small and medium-sized enterprise and sustainability and technology transfer and university sector and Kwangju [South Korea] and South Korea";"Technology commercialization through sustainable knowledge sharing from university-industry collaborations, with a focus on patent propensity";"The process of technology commercialization involves numerous hurdles, from the original idea to its translation into the market. Patenting brings to light the research activities created through university-industry collaborations. This paper explores patent propensity, as related to commercializing innovative activities resulting from collaborations between universities and regional small and medium enterprises (SMEs). To achieve our aims, we apply a robust regression analysis to test five research hypotheses using firm-level data on 263 firms located in the Gwangju region of Korea. Our empirical results show that certain industry characteristics are negatively related to the propensity to patent. In addition, and contrary to expectations, it is found that the InnoBiz firms that the government designated as innovative SMEs are not performing any differently from general firms. It is only the CEO's academic credentials that are found to be positively related to propensity to patent. From the findings, we can conclude that patenting propensity is likely related to CEOs' managerial strategies rather than the particular characteristics of the technology in question. We also suggest new technology commercialization related with universities' policies and support to promote regional SMEs including conglomerated firms as well as universities. 2017 by the author.";"Patent propensity and Regional SMEs and Technology transfer and commercialization and University-industry collaboration and commercialization and data set and government and industrial development and industrial enterprise and industrial policy and industrial practice and innovation and intellectual property rights and knowledge and regional pattern and regression analysis and small and medium-sized enterprise and sustainability and technology transfer and university sector and Kwangju [South Korea] and South Korea";"";"JOUR";"Han, J.";"";"Sustainability (Switzerland)";"2017";"9";"10";NA;NA;"10.3390/su9101808";"English";"../../data/raw_data/scopus_patent_propensity.ris"
"63";"Emodi_2017_InJoofInanTeMa";"This literature review explores the factors influencing a firm's decision to patent its innovation. From the review of the available literature, some factors were identified which are related to the degree of codification or simplicity of knowledge and characteristics of a company or firm. We discovered that patent propensity vary among firms, industry, and country. The influencing factors on a firm's patent propensity were discovered to be both internal and external. The literature review will provide assistance to researchers in understanding the factors influencing patent propensity. World Scientific Publishing Company. firm's strategy and imitation and innovation and patent and Patent propensity and R&D activities";"A Literature Review on the Factors Influencing Patent Propensity";"This literature review explores the factors influencing a firm's decision to patent its innovation. From the review of the available literature, some factors were identified which are related to the degree of codification or simplicity of knowledge and characteristics of a company or firm. We discovered that patent propensity vary among firms, industry, and country. The influencing factors on a firm's patent propensity were discovered to be both internal and external. The literature review will provide assistance to researchers in understanding the factors influencing patent propensity. World Scientific Publishing Company.";"firm's strategy and imitation and innovation and patent and Patent propensity and R&D activities";"";"JOUR";"Emodi, N.V. and Murthy, G.P. and Emodi, C.C. and Emodi, A.S.A.";"";"International Journal of Innovation and Technology Management";"2017";"14";"3";NA;NA;"10.1142/S0219877017500158";"English";"../../data/raw_data/scopus_patent_propensity.ris"
"64";"Rocheska_2017_TEMJou";"The innovation and proprietary knowledge nowadays represent a basis for new competitive strategies of the companies. In that regard, the patents are among the most representative indicators for their innovative activities. This paper is primarily focused on assessing the relationship between innovation and patent propensity of SMEs. More precisely, the main objective is to identify the significant factors that affect patent propensity of SMEs and to determine the implications of patents upon the SMEs innovation. In this context, the paper encompasses an analysis of several relevant factors such as the available resources of SMEs, the strategies for development of intellectual property rights and the impact of policy measures. The empirical analysis of the patent propensity of SMEs is performed in a country specific context for Macedonia which provides a basis for proposing appropriate policy recommendations. 2017 Slavica Rocheska et al. Innovation and Patent propensity and SMEs growth";"Factors affecting innovation and patent propensity of SMEs Evidence from Macedonia";"The innovation and proprietary knowledge nowadays represent a basis for new competitive strategies of the companies. In that regard, the patents are among the most representative indicators for their innovative activities. This paper is primarily focused on assessing the relationship between innovation and patent propensity of SMEs. More precisely, the main objective is to identify the significant factors that affect patent propensity of SMEs and to determine the implications of patents upon the SMEs innovation. In this context, the paper encompasses an analysis of several relevant factors such as the available resources of SMEs, the strategies for development of intellectual property rights and the impact of policy measures. The empirical analysis of the patent propensity of SMEs is performed in a country specific context for Macedonia which provides a basis for proposing appropriate policy recommendations. 2017 Slavica Rocheska et al.";"Innovation and Patent propensity and SMEs growth";"";"JOUR";"Rocheska, S. and Nikoloski, D. and Angeleski, M. and Mancheski, G.";"";"TEM Journal";"2017";"6";"2";"407";"415";"10.18421/TEM62-28";"English";"../../data/raw_data/scopus_patent_propensity.ris"
"65";"Agostini_2017_ManaDeci";"Purpose Considering that SMEs are widely recognized as important innovators and, in the past years, have registered increasing levels of patenting, the purpose of this paper is to unveil the impact of both internal and external knowledge sourcing on SME patenting performance and test the moderating role of formal plan for innovation and absorptive capacity. Design/methodology/approach The authors propose an econometric approach based on a Hurdle Count Data Model which allows the authors not only to overcome problems related to the count dependent variables often assuming zero values, but also to separate patent propensity from patent portfolio size. Findings This methodology puts in evidence that an internal factor (i.e. employee skills for innovation) significantly influences SME patent propensity, while an external factor (i.e. open innovation with business partners) impacts SME portfolio size. Moreover, both formal plan for innovation and absorptive capacity play an important moderating role. Originality/value This paper embraces a knowledge perspective to investigate the determinants of SME patenting, which contributes to the knowledge-based view of the firm in the SME domain. Moreover, differently from most studies in the area of patenting which adopt a macro-level perspective and rely on secondary data, it assumes a firm-level approach and bases on primary data, which contributes to make it particularly distinctive. 2017, Emerald Publishing Limited. Absorptive capacity and Innovation and Knowledge and Patents and SME";"A dual knowledge perspective on the determinants of SME patenting Results of an empirical investigation";"Purpose Considering that SMEs are widely recognized as important innovators and, in the past years, have registered increasing levels of patenting, the purpose of this paper is to unveil the impact of both internal and external knowledge sourcing on SME patenting performance and test the moderating role of formal plan for innovation and absorptive capacity. Design/methodology/approach The authors propose an econometric approach based on a Hurdle Count Data Model which allows the authors not only to overcome problems related to the count dependent variables often assuming zero values, but also to separate patent propensity from patent portfolio size. Findings This methodology puts in evidence that an internal factor (i.e. employee skills for innovation) significantly influences SME patent propensity, while an external factor (i.e. open innovation with business partners) impacts SME portfolio size. Moreover, both formal plan for innovation and absorptive capacity play an important moderating role. Originality/value This paper embraces a knowledge perspective to investigate the determinants of SME patenting, which contributes to the knowledge-based view of the firm in the SME domain. Moreover, differently from most studies in the area of patenting which adopt a macro-level perspective and rely on secondary data, it assumes a firm-level approach and bases on primary data, which contributes to make it particularly distinctive. 2017, Emerald Publishing Limited.";"Absorptive capacity and Innovation and Knowledge and Patents and SME";"";"JOUR";"Agostini, L. and Nosella, A.";"";"Management Decision";"2017";"55";"6";"1226";"1247";"10.1108/MD-04-2016-0215";"English";"../../data/raw_data/scopus_patent_propensity.ris"
"69";"Asid_2016_JurnEkonMala";"This research relies on the theory of endogenous growth, where the role of foreign imported capital and triadic patent propensity is assumed to endogenously determine the growth process of a group of 36 developing and emerging economies for the years 1990-2010. Our results confirm the monotonicity hypothesis from both foreign imported technology and triadic patent propensity toward technical efficiency improvement with no indication of pure TFP growth. The results indicate that initial foreign capital and initial triadic patent propensity only minimally improve the technical efficiency change for a small number of economies with nearly halve of the sample deviating from the convergence point. Convergence and Efficiency and Foreign technology and Stochastic frontier analysis and Triadic patent propensity";"The effects of foreign R&D and triadic patent propensity on developing economies efficiency and convergence";"This research relies on the theory of endogenous growth, where the role of foreign imported capital and triadic patent propensity is assumed to endogenously determine the growth process of a group of 36 developing and emerging economies for the years 1990-2010. Our results confirm the monotonicity hypothesis from both foreign imported technology and triadic patent propensity toward technical efficiency improvement with no indication of pure TFP growth. The results indicate that initial foreign capital and initial triadic patent propensity only minimally improve the technical efficiency change for a small number of economies with nearly halve of the sample deviating from the convergence point.";"Convergence and Efficiency and Foreign technology and Stochastic frontier analysis and Triadic patent propensity";"";"JOUR";"Asid, R. and Khalifah, N.A.";"";"Jurnal Ekonomi Malaysia";"2016";"50";"2";"107";"124";"10.17576/JEM-2016-5001-09";"English";"../../data/raw_data/scopus_patent_propensity.ris"
"70";"Bhaskarabhatla_2014_IndandInn";"Why do large firms disclose patentable inventions defensively? We study IBM's disclosure and patenting activity and find that stronger antitrust enforcement and consent decrees limiting patent protection lead to more defensive disclosure. We extend our analysis to Xerox and show, using a differences-in-differences approach, a decline in patent propensity and an increase in patent scope in patent classes affected by the 1975 consent decree. We extend our analysis to include AT&T, the other exceptionally large firm with defensive-disclosure activity, and show that their patenting propensity declined under increased antitrust enforcement relative to other firms in the industry. Overall, we show how these firms used defensive disclosure as a strategy to balance the benefits of patenting with the costs of uncertain antitrust enforcement. Our results are especially relevant in light of the defensive patent strategies many firms employ to preempt and cope with patent litigation. 2014 Taylor & Francis. L50 and O34 and O38 and industrial enterprise and innovation and legal system";"Defensive Disclosure of Patentable Inventions under Antitrust Enforcement";"Why do large firms disclose patentable inventions defensively? We study IBM's disclosure and patenting activity and find that stronger antitrust enforcement and consent decrees limiting patent protection lead to more defensive disclosure. We extend our analysis to Xerox and show, using a differences-in-differences approach, a decline in patent propensity and an increase in patent scope in patent classes affected by the 1975 consent decree. We extend our analysis to include AT&T, the other exceptionally large firm with defensive-disclosure activity, and show that their patenting propensity declined under increased antitrust enforcement relative to other firms in the industry. Overall, we show how these firms used defensive disclosure as a strategy to balance the benefits of patenting with the costs of uncertain antitrust enforcement. Our results are especially relevant in light of the defensive patent strategies many firms employ to preempt and cope with patent litigation. 2014 Taylor & Francis.";"L50 and O34 and O38 and industrial enterprise and innovation and legal system";"";"JOUR";"Bhaskarabhatla, A. and Pennings, E.";"";"Industry and Innovation";"2014";"21";"7-8";"533";"552";"10.1080/13662716.2014.987452";"English";"../../data/raw_data/scopus_patent_propensity.ris"
"71";"Teixeira_2013_JoofTeMaanIn";"A large number of studies have emphasized the spatial proximity of economic activity and its relation to the spatiality of knowledge creation in various types of connections. Far less attention has been paid to the understanding of the determinants of 'cultural' and geographical proximity in international R&D cooperation projects involving SMEs and the role of the quality of the Regional Innovation System (RIS). Using a database of completed European Cooperative Research projects, we conclude that 1) technologically more complex projects are more likely to involve 'culturally' and geographically distant partners; 2) RIS related variables determine 'cultural' proximity but not geographical proximity; 3) at first sight surprisingly, international cooperation projects involving the 1st promoters of innovation-led regions (high patent propensity and high human capital levels) are culturally more distant. Universidad Alberto Hurtado, Facultad de Economa y Negocios. Cooperation and CRAFTs and Innovation and Regional innovation system and SMEs";"International regional patterns of R & D networks involving low tech SMEs";"A large number of studies have emphasized the spatial proximity of economic activity and its relation to the spatiality of knowledge creation in various types of connections. Far less attention has been paid to the understanding of the determinants of 'cultural' and geographical proximity in international R&D cooperation projects involving SMEs and the role of the quality of the Regional Innovation System (RIS). Using a database of completed European Cooperative Research projects, we conclude that 1) technologically more complex projects are more likely to involve 'culturally' and geographically distant partners; 2) RIS related variables determine 'cultural' proximity but not geographical proximity; 3) at first sight surprisingly, international cooperation projects involving the 1st promoters of innovation-led regions (high patent propensity and high human capital levels) are culturally more distant. Universidad Alberto Hurtado, Facultad de Economa y Negocios.";"Cooperation and CRAFTs and Innovation and Regional innovation system and SMEs";"";"JOUR";"Teixeira, A.A.C. and Santos, P. and Paula Delgado, A.";"";"Journal of Technology Management and Innovation";"2013";"8";"2";"1";"20";NA;"English";"../../data/raw_data/scopus_patent_propensity.ris"
"72";"Kleinknecht_2013_InanGrFrR.StofInFitoEcTeCh";"Confronting patent applications to a 'true' measure of innovative output in the German CIS, the chapter concludes that patent applications are mainly done by innovators that develop new (physical) goods. Compared to goods innovators, service and process innovators show quite poor patenting rates. Collaboration with universities increases the propensity to patent, while collaboration with other partners does not. An innovator's orientation to local and national markets reduces, while international market orientation increases the probability of applying for patents. The estimates suggest dividing industries into two classes high versus low patent propensity industries. Low patent propensity industries include all services industries as well as most traditional manufacturing industries. The probabilities estimated might give a clue to users of patent databases about the extent of their measurement bias when using patents as an innovation indicator. Especially service oriented innovations may not be equally captured by patent data. Oxford University Press 2012. All rights reserved. Innovation indicators and Product innovation and Propensity to patent and R&D";"How Good Are Patents as Innovation Indicators? Evidence from German CIS Data";"Confronting patent applications to a 'true' measure of innovative output in the German CIS, the chapter concludes that patent applications are mainly done by innovators that develop new (physical) goods. Compared to goods innovators, service and process innovators show quite poor patenting rates. Collaboration with universities increases the propensity to patent, while collaboration with other partners does not. An innovator's orientation to local and national markets reduces, while international market orientation increases the probability of applying for patents. The estimates suggest dividing industries into two classes high versus low patent propensity industries. Low patent propensity industries include all services industries as well as most traditional manufacturing industries. The probabilities estimated might give a clue to users of patent databases about the extent of their measurement bias when using patents as an innovation indicator. Especially service oriented innovations may not be equally captured by patent data. Oxford University Press 2012. All rights reserved.";"Innovation indicators and Product innovation and Propensity to patent and R&D";"";"CHAP";"Kleinknecht, A. and Reinders, H.J.";"";"Innovation and Growth From R&D Strategies of Innovating Firms to Economy-wide Technological Change";"2013";NA;NA;NA;NA;"10.1093/acprofoso/9780199646685.003.0006";"English";"../../data/raw_data/scopus_patent_propensity.ris"
"74";"Holgersson_2013_RaDM";"Managers make a number of strategic choices when trying to capture returns from innovation investments, including what appropriation strategy to use and whether or not to patent, strategic choices that depend among other things on firm size. Previous literature, being reviewed in this paper, shows that the patent propensity is lower in small and medium-sized enterprises (SMEs) than in large firms and that patenting as means for appropriation is of less importance among SMEs. Chief executive officers (CEOs) and/or research and development (R&D) managers of 26 entrepreneurial SMEs have been interviewed to explain these differences and to provide insight on how patenting is used in SMEs. The patent competence was low among the studied SMEs, and internal patent resources were found to be important for effective and efficient use of the patent system, for application as well as monitoring and enforcement. While of limited perceived importance for protecting inventions in entrepreneurial SMEs, patents were used to attract customers and venture capital, which is of utmost importance for the survival and growth of these firms. Thus, patenting has an important role to play even in firms where the protective function of patents is secondary. 2012 The Author. R&D Management 2012 Blackwell Publishing Ltd. NA";"Patent management in entrepreneurial SMEs A literature review and an empirical study of innovation appropriation, patent propensity, and motives";"Managers make a number of strategic choices when trying to capture returns from innovation investments, including what appropriation strategy to use and whether or not to patent, strategic choices that depend among other things on firm size. Previous literature, being reviewed in this paper, shows that the patent propensity is lower in small and medium-sized enterprises (SMEs) than in large firms and that patenting as means for appropriation is of less importance among SMEs. Chief executive officers (CEOs) and/or research and development (R&D) managers of 26 entrepreneurial SMEs have been interviewed to explain these differences and to provide insight on how patenting is used in SMEs. The patent competence was low among the studied SMEs, and internal patent resources were found to be important for effective and efficient use of the patent system, for application as well as monitoring and enforcement. While of limited perceived importance for protecting inventions in entrepreneurial SMEs, patents were used to attract customers and venture capital, which is of utmost importance for the survival and growth of these firms. Thus, patenting has an important role to play even in firms where the protective function of patents is secondary. 2012 The Author. R&D Management 2012 Blackwell Publishing Ltd.";NA;"";"JOUR";"Holgersson, M.";"";"R and D Management";"2013";"43";"1";"21";"36";"10.1111/j.1467-9310.2012.00700.x";"English";"../../data/raw_data/scopus_patent_propensity.ris"
"76";"Kwon_2012_KoreEconRevi";"This paper considers a patent portfolio race where firms compete for complementary patents, called a patent thicket. When firms have an option to keep their innovation secret, this paper shows that there exists an equilibrium where firms' patent propensity is strictly between zero and one. In such an equilibrium, stronger patent protection reduces the firms' investment in innovation. Moreover, this result does not change even when a licensing contract is feasible. Licensing and Patent Thicket and Secrecy";"Patent thicket, secrecy, and licensing";"This paper considers a patent portfolio race where firms compete for complementary patents, called a patent thicket. When firms have an option to keep their innovation secret, this paper shows that there exists an equilibrium where firms' patent propensity is strictly between zero and one. In such an equilibrium, stronger patent protection reduces the firms' investment in innovation. Moreover, this result does not change even when a licensing contract is feasible.";"Licensing and Patent Thicket and Secrecy";"";"JOUR";"Kwon, I.";"";"Korean Economic Review";"2012";"28";"1";"27";"49";NA;"English";"../../data/raw_data/scopus_patent_propensity.ris"
