"";"id";"text";"title";"abstract";"keywords";"methods";"type";"authors";"affiliation";"source";"year";"volume";"issue";"startpage";"endpage";"doi";"language";"database"
"28";"Kato_2018_Tech";"Using a panel data set based on repeated questionnaire surveys of Japanese start-up firms, this study examines the effects of numerical labor flexibility on the innovation outcomes of start-up firms, a topic on which there is currently insufficient research. Here, numerical labor flexibility is defined as the external labor turnover of regular employees and the proportion of non-regular employees, and innovation outcomes include product innovation and patent applications. The estimation results of a random-effects probit model indicate that an inverted U-shaped relationship exists between the external labor turnover of regular employees and the probability of patent applications. Moreover, a similar U-shaped relationship exists between the proportion of non-regular employees and the probability of product innovation. These results are interpreted in light of the organizational characteristics of start-up firms. The implications of the findings are discussed. Start-up firm and Numerical labor flexibility and External labor turnover of regular employees and The proportion of non-regular employees and Product innovation and Patent applications and Panel data";"Numerical labor flexibility and innovation outcomes of start-up firms A panel data analysis";"Using a panel data set based on repeated questionnaire surveys of Japanese start-up firms, this study examines the effects of numerical labor flexibility on the innovation outcomes of start-up firms, a topic on which there is currently insufficient research. Here, numerical labor flexibility is defined as the external labor turnover of regular employees and the proportion of non-regular employees, and innovation outcomes include product innovation and patent applications. The estimation results of a random-effects probit model indicate that an inverted U-shaped relationship exists between the external labor turnover of regular employees and the probability of patent applications. Moreover, a similar U-shaped relationship exists between the proportion of non-regular employees and the probability of product innovation. These results are interpreted in light of the organizational characteristics of start-up firms. The implications of the findings are discussed.";"Start-up firm and Numerical labor flexibility and External labor turnover of regular employees and The proportion of non-regular employees and Product innovation and Patent applications and Panel data";"";"JOUR";"Kato, Masatoshi and Zhou, Haibo";"";"Technovation";"2018";"69";NA;"15";"27";"10.1016/j.technovation.2017.10.002";"";"../../data/raw_data/sciencedirect_probability_of_patent.ris"
"29";"Dodek_1973_AmerHearJour";"Forty-five patients having saphenous vein aortocoronary bypass surgery were studied prospectively by pre- and post-operative hypoxemia and graded exercise electrocardiography. The stress electrocardiographic results were correlated with the degree of symptomatic relief and the angiographic evidence of graft patency and the distribution and evolution of coronary occlusive disease. Forty-one of the total group of 45 patients (91 per cent) and 32 of 34 (94 per cent) with one or more documented open grafts had excellent or good symptomatic improvement. Incongruously, five of seven patients with closed grafts also had significant clinical improvement. Functional improvement was documented in 53 per cent of patients after aortocoronary bypass surgery, in terms of postoperative reversal of the preoperatively positive stress ECG or persistance of a negative stress ECG, together with the achievement of significantly greater mean maximum exercise and heart rate. All of these patients had one or more patent saphenous vein bypass grafts. Forty-seven per cent of the patients failed to display objective evidence of improvement post-operatively the stress ECG either remained positive, or became so, and, collectively, the group was unable to significantly increase the mean maximum exercise level or heart rate, in comparison to that achieved before surgery. Only 65 per cent of these subjects had one or more patent bypass grafts. Stress electrocardiography and quantitation of the maximum work and heart rate achieved by exercise provide accurate assessments of the relief of myocardial ischemia produced by myocardial revascularization. In this study, when the post-operative stress ECG was negative and the patient was able to achieve significantly greater exercise and heart rate, the probability of patency of one or more bypass grafts was virtually certain. On the other hand, when the postoperative stress ECG was positive and little or no increase in exercise and heart rate was possible, there was high probability of graft occlusion or significant residual coronary disease. NA";"Stress electrocardiography in the evaluation of aortocoronary bypass surgery";"Forty-five patients having saphenous vein aortocoronary bypass surgery were studied prospectively by pre- and post-operative hypoxemia and graded exercise electrocardiography. The stress electrocardiographic results were correlated with the degree of symptomatic relief and the angiographic evidence of graft patency and the distribution and evolution of coronary occlusive disease. Forty-one of the total group of 45 patients (91 per cent) and 32 of 34 (94 per cent) with one or more documented open grafts had excellent or good symptomatic improvement. Incongruously, five of seven patients with closed grafts also had significant clinical improvement. Functional improvement was documented in 53 per cent of patients after aortocoronary bypass surgery, in terms of postoperative reversal of the preoperatively positive stress ECG or persistance of a negative stress ECG, together with the achievement of significantly greater mean maximum exercise and heart rate. All of these patients had one or more patent saphenous vein bypass grafts. Forty-seven per cent of the patients failed to display objective evidence of improvement post-operatively the stress ECG either remained positive, or became so, and, collectively, the group was unable to significantly increase the mean maximum exercise level or heart rate, in comparison to that achieved before surgery. Only 65 per cent of these subjects had one or more patent bypass grafts. Stress electrocardiography and quantitation of the maximum work and heart rate achieved by exercise provide accurate assessments of the relief of myocardial ischemia produced by myocardial revascularization. In this study, when the post-operative stress ECG was negative and the patient was able to achieve significantly greater exercise and heart rate, the probability of patency of one or more bypass grafts was virtually certain. On the other hand, when the postoperative stress ECG was positive and little or no increase in exercise and heart rate was possible, there was high probability of graft occlusion or significant residual coronary disease.";NA;"";"JOUR";"Dodek, Arthur and Kassebaum, Donald G. and Griswold, Herbert E.";"";"American Heart Journal";"1973";"86";"3";"292";"307";"10.1016/0002-8703(73)90038-0";"";"../../data/raw_data/sciencedirect_probability_of_patent.ris"
"30";"Huang_2015_JoofEnanTeMa";"We distinguish between two firm patenting behaviors (never patent and always patent) and present a two-factor (capability and willingness) patenting behavior framework to enrich existing research. We examine innovative activities on 165 Taiwanese information and communication technology firms by using a zero-inflated Poisson regression model. Our results suggest that determinants of increasing probability of patenting are not completely the same as ones of decreasing probability of not patenting. Moreover, while capability factors are positively associated with propensity to patent, willingness factors moderate the relationship between capability factors and propensity to patent. Patenting and Innovation competence and Innovation and Zero-inflated Poisson regression model and Patent";"Determinants of firms patenting or not patenting behaviors";"We distinguish between two firm patenting behaviors (never patent and always patent) and present a two-factor (capability and willingness) patenting behavior framework to enrich existing research. We examine innovative activities on 165 Taiwanese information and communication technology firms by using a zero-inflated Poisson regression model. Our results suggest that determinants of increasing probability of patenting are not completely the same as ones of decreasing probability of not patenting. Moreover, while capability factors are positively associated with propensity to patent, willingness factors moderate the relationship between capability factors and propensity to patent.";"Patenting and Innovation competence and Innovation and Zero-inflated Poisson regression model and Patent";"";"JOUR";"Huang, Kuo-Feng and Cheng, Tsung-Chi";"";"Journal of Engineering and Technology Management";"2015";"36";NA;"52";"77";"10.1016/j.jengtecman.2015.05.003";"";"../../data/raw_data/sciencedirect_probability_of_patent.ris"
"31";"Meng_2016_ResePoli";"Drawing upon the theory of gender frame, the research on gender in science, and social network studies, this paper focuses on the social mechanism of collaboration, specifically the boundary-spanning collaboration, to understand the gender gap in academic patenting in the U.S. Correspondingly, the author developed a few hypotheses for empirical testing. The results show that, else being equal, only collaboration with industry would significantly increase the probability of patenting for female academic scientists, but this helps explain considerable difference in patenting between female and male academics. The findings are discussed along with the limitations and policy implications at the end. Gender and Academic patenting and Science and Collaboration and Network and Social capital";"Collaboration patterns and patenting Exploring gender distinctions";"Drawing upon the theory of gender frame, the research on gender in science, and social network studies, this paper focuses on the social mechanism of collaboration, specifically the boundary-spanning collaboration, to understand the gender gap in academic patenting in the U.S. Correspondingly, the author developed a few hypotheses for empirical testing. The results show that, else being equal, only collaboration with industry would significantly increase the probability of patenting for female academic scientists, but this helps explain considerable difference in patenting between female and male academics. The findings are discussed along with the limitations and policy implications at the end.";"Gender and Academic patenting and Science and Collaboration and Network and Social capital";"";"JOUR";"Meng, Yu";"";"Research Policy";"2016";"45";"1";"56";"67";"10.1016/j.respol.2015.07.004";"";"../../data/raw_data/sciencedirect_probability_of_patent.ris"
"32";"Payelle_1997_AnofVaSu";"Between March 1987 and March 1993 we used pulsed transthrombotic fibrinolysis to treat 58 symptomatic thrombotic occlusions of lower limb bypass grafts in 45 patients. There were 17 suprainguinal grafts and 28 infrainguinal grafts. Treatment consisted of pulsed infusion of fibrinolytic agents into the thrombus followed by continuous infusion using an electric pump. Minor percutaneous or surgical procedures were often associated. The mean delay to treatment was 7 days. The mean duration of treatment was 150 66 minutes. Immediate patency was achieved in 88% of cases with no significant difference between suprainguinal and infrainguinal grafts. The clinical success rate was 55%. Actuarial patency at 1 year was 54% 11% for suprainguinal grafts and 26% 7% for infrainguinal grafts. The probability of patency was much lower in patients whose grafts had been implanted within 3 months before occlusion and in patients in whom an adjuvant procedure had not been performed. This study demonstrates that, in cases not requiring immediate surgery, pulsed transthrombotic fibrinolysis can achieve durable patency by treating both the bypass and distal arterial network. This technique allows identification of lesions causing thrombosis and adaptation of treatment specifically to these lesions. NA";"Pulsed Transthrombotic Fibrinolysis Technique and Results in the Management of Occluded Lower Limb Bypass Grafts";"Between March 1987 and March 1993 we used pulsed transthrombotic fibrinolysis to treat 58 symptomatic thrombotic occlusions of lower limb bypass grafts in 45 patients. There were 17 suprainguinal grafts and 28 infrainguinal grafts. Treatment consisted of pulsed infusion of fibrinolytic agents into the thrombus followed by continuous infusion using an electric pump. Minor percutaneous or surgical procedures were often associated. The mean delay to treatment was 7 days. The mean duration of treatment was 150 66 minutes. Immediate patency was achieved in 88% of cases with no significant difference between suprainguinal and infrainguinal grafts. The clinical success rate was 55%. Actuarial patency at 1 year was 54% 11% for suprainguinal grafts and 26% 7% for infrainguinal grafts. The probability of patency was much lower in patients whose grafts had been implanted within 3 months before occlusion and in patients in whom an adjuvant procedure had not been performed. This study demonstrates that, in cases not requiring immediate surgery, pulsed transthrombotic fibrinolysis can achieve durable patency by treating both the bypass and distal arterial network. This technique allows identification of lesions causing thrombosis and adaptation of treatment specifically to these lesions.";NA;"";"JOUR";"Payelle, Gilles and Maiza, Dominique and Coffin, Olivier and Alachkar, Fadi and Alsweis, Suhail and Courtheoux, Patrick and Khayat, Marie-Chantal and Grard, Jean-Louis and Thron, Jacques";"";"Annals of Vascular Surgery";"1997";"11";"2";"159";"164";"10.1007/s100169900027";"";"../../data/raw_data/sciencedirect_probability_of_patent.ris"
"34";"Pantano_2018_JoofReanCoSe";"Previous studies have demonstrated the extent to which an analysis of patent growth can be used to study the innovation level of a certain industry, national competitiveness in terms of technological innovation, and the inventive capacity in a specific domain etc. In terms of the retail industry, there is a propensity for patenting and an increasing consumer demand for technological innovation. In fact, integrating innovative technologies, including innovative systems for conducting product searches and comparisons, and for paying, are one of the most efficient ways to create value for businesses. Building on a historical series of patents from 1990 to 2015, this paper explores the trends in the sector, analysing the increasing number of patents. Secondly it develops a predictive curve, a technology-push curve (TPC) for making some predictions about the future directions in the retail industry that might affect retailers competitiveness and subsequent innovation management strategies. Patent analysis and Retailing and Innovation management and Retailer competitiveness and Technology-push curve (TPC)";"Knowledge Push Curve (KPC) in retailing Evidence from patented innovations analysis affecting retailers' competitiveness";"Previous studies have demonstrated the extent to which an analysis of patent growth can be used to study the innovation level of a certain industry, national competitiveness in terms of technological innovation, and the inventive capacity in a specific domain etc. In terms of the retail industry, there is a propensity for patenting and an increasing consumer demand for technological innovation. In fact, integrating innovative technologies, including innovative systems for conducting product searches and comparisons, and for paying, are one of the most efficient ways to create value for businesses. Building on a historical series of patents from 1990 to 2015, this paper explores the trends in the sector, analysing the increasing number of patents. Secondly it develops a predictive curve, a technology-push curve (TPC) for making some predictions about the future directions in the retail industry that might affect retailers competitiveness and subsequent innovation management strategies.";"Patent analysis and Retailing and Innovation management and Retailer competitiveness and Technology-push curve (TPC)";"";"JOUR";"Pantano, Eleonora and Priporas, Constantinos-Vasilios and Stylos, Nikolaos";"";"Journal of Retailing and Consumer Services";"2018";"44";NA;"150";"160";"10.1016/j.jretconser.2018.06.004";"";"../../data/raw_data/sciencedirect_propensity_to_patent.ris"
"35";"Bann_2016_JoofFaBuSt";"This paper provides new evidence of innovation processes in family firms by investigating their attitude toward the protection of innovation outputs. More specifically, the main objective is to understand, through the SEW (Socioemotional Wealth) lens, whether innovative family firms tend to use patents as a tool for protecting intellectual property. Based on a sample of 229 Italian companies that make R&D investments, our analysis highlights that degree of alignment with the family business model is a significant predictor of a firms attitude toward protecting innovation with patents, even though not all of the dimensions of a family business have the same effect. When disentangling the effect of three different indicators (i.e., family ownership, family governance and the presence of young successors), family involvement in the board of directors is a negative significant driver, the presence of young successors is a positive driver, and ownership has no effect. Family firms and Propensity to patent and Empirical analysis";"Propensity to patent by family firms";"This paper provides new evidence of innovation processes in family firms by investigating their attitude toward the protection of innovation outputs. More specifically, the main objective is to understand, through the SEW (Socioemotional Wealth) lens, whether innovative family firms tend to use patents as a tool for protecting intellectual property. Based on a sample of 229 Italian companies that make R&D investments, our analysis highlights that degree of alignment with the family business model is a significant predictor of a firms attitude toward protecting innovation with patents, even though not all of the dimensions of a family business have the same effect. When disentangling the effect of three different indicators (i.e., family ownership, family governance and the presence of young successors), family involvement in the board of directors is a negative significant driver, the presence of young successors is a positive driver, and ownership has no effect.";"Family firms and Propensity to patent and Empirical analysis";"";"JOUR";"Bann, Mariasole";"";"Journal of Family Business Strategy";"2016";"7";"4";"238";"248";"10.1016/j.jfbs.2016.07.002";"";"../../data/raw_data/sciencedirect_propensity_to_patent.ris"
"36";"Barros_2015_Tech";"Most observations of the patent behavior of firms are derived from institutional environments in which relatively strong protection can be obtained, even if patents per se are imperfect protection mechanisms. As a result, the determinants of a firm's propensity to patent in a weak appropriability regime are still unclear. This paper advances our current understanding of patent behavior by exploring the effects of manufacturing firms innovation partnerships, foreign ownership, and adoption of new management practices on the likelihood of patenting. Our analysis is based on the responses of firms to questions in the Brazilian Industrial Survey of Technological Innovation (Pintec). The findings presented here indicate that, despite the weaknesses of the patent system, firms engaged in innovation-oriented collaborations are more likely to patent than firms not involved in these partnerships. Additionally, the results reveal that domestic and foreign firms in a weak institutional environment are similar in their inclination to patent. Finally, the empirical exercise shows that when a patent system is characterized by high levels of formalism and low levels of safeguarding against infringements of property rights firms adopt novel management practices as substitutes for patents. Patent and Partnership and Multinational enterprises (MNEs) and Management practices and Institutions and Brazil";"Exploring the use of patents in a weak institutional environment The effects of innovation partnerships, firm ownership, and new management practices";"Most observations of the patent behavior of firms are derived from institutional environments in which relatively strong protection can be obtained, even if patents per se are imperfect protection mechanisms. As a result, the determinants of a firm's propensity to patent in a weak appropriability regime are still unclear. This paper advances our current understanding of patent behavior by exploring the effects of manufacturing firms innovation partnerships, foreign ownership, and adoption of new management practices on the likelihood of patenting. Our analysis is based on the responses of firms to questions in the Brazilian Industrial Survey of Technological Innovation (Pintec). The findings presented here indicate that, despite the weaknesses of the patent system, firms engaged in innovation-oriented collaborations are more likely to patent than firms not involved in these partnerships. Additionally, the results reveal that domestic and foreign firms in a weak institutional environment are similar in their inclination to patent. Finally, the empirical exercise shows that when a patent system is characterized by high levels of formalism and low levels of safeguarding against infringements of property rights firms adopt novel management practices as substitutes for patents.";"Patent and Partnership and Multinational enterprises (MNEs) and Management practices and Institutions and Brazil";"";"JOUR";"Barros, Henrique M.";"";"Technovation";"2015";"45-46";NA;"63";"77";"10.1016/j.technovation.2015.05.003";"";"../../data/raw_data/sciencedirect_propensity_to_patent.ris"
"37";"Carney_2018_JoofFaBuSt";"The paper is motivated by recent findings about family firms (FFs) ability to do more with less in the innovation process, which we dub lean innovation. We consider lean innovation patenting strategies in an emerging market context that is undergoing improvement in its intellectual property protection (IPP) regime. Grounded in upper echelons theory we expect that the initiation of an intra-family succession will lead to generational shift in a FFs approach to IPP, as evinced in its patenting strategy. Applying a difference in difference methodology we are able to compare FFs who have undertaken an intra-family succession with FFs who have not yet initiated a succession process. Further, we consider the second difference as a strategy change between the pre-and post-succession period thereby isolating the effects of the post-succession change on patenting strategy. We also distinguish between different patent types (invention, utility, and design), and consider FF propensity to patent, and patent conversion rates. Based on generational differences between founders and successors we find successors are significant adopters of lean innovation patenting strategies. We add to the sparse literature on succession in emerging market FFs and contribute to improved understandings of long-term FF strategic adaptation in a dynamic institutional landscape. FFs and Succession and Intellectual property protection and Patents and Upper echelons";"Lean innovation Family firm succession and patenting strategy in a dynamic institutional landscape";"The paper is motivated by recent findings about family firms (FFs) ability to do more with less in the innovation process, which we dub lean innovation. We consider lean innovation patenting strategies in an emerging market context that is undergoing improvement in its intellectual property protection (IPP) regime. Grounded in upper echelons theory we expect that the initiation of an intra-family succession will lead to generational shift in a FFs approach to IPP, as evinced in its patenting strategy. Applying a difference in difference methodology we are able to compare FFs who have undertaken an intra-family succession with FFs who have not yet initiated a succession process. Further, we consider the second difference as a strategy change between the pre-and post-succession period thereby isolating the effects of the post-succession change on patenting strategy. We also distinguish between different patent types (invention, utility, and design), and consider FF propensity to patent, and patent conversion rates. Based on generational differences between founders and successors we find successors are significant adopters of lean innovation patenting strategies. We add to the sparse literature on succession in emerging market FFs and contribute to improved understandings of long-term FF strategic adaptation in a dynamic institutional landscape.";"FFs and Succession and Intellectual property protection and Patents and Upper echelons";"";"JOUR";"Carney, Michael and Zhao, Jing and Zhu, Limin";"";"Journal of Family Business Strategy";"2018";NA;NA;NA;NA;"10.1016/j.jfbs.2018.03.002";"";"../../data/raw_data/sciencedirect_propensity_to_patent.ris"
