"";"id";"text";"title";"abstract";"keywords";"methods";"type";"authors";"affiliation";"source";"year";"volume";"issue";"startpage";"endpage";"doi";"language";"database"
"115";"Fernndez.Sastre_2015_InnManPolandPra";"This paper evaluates the impact of Ecuadorian innovation support programs, which are intended to enhance firms' technological and managerial capabilities, on firms' innovative behavior and performance. In order to estimate the causal effects, we employ different Propensity Score Matching procedures. Results indicate that participating in a program increases firms' internal R&D and innovation effort, the qualification of the workforce, the likelihood of introducing product, process and organizational innovations and the probability of establishing linkages with research partners. However, participants do not show greater external R&D intensity or a higher propensity to patent, nor are they more likely to cooperate with suppliers, customer or competitors. 2016 Informa UK Limited, trading as Taylor & Francis Group. Emerging innovation systems and Impact assessment and Innovation support programs and Technological capabilities";"The effects of developing-countries' innovation support programs Evidence from Ecuador";"This paper evaluates the impact of Ecuadorian innovation support programs, which are intended to enhance firms' technological and managerial capabilities, on firms' innovative behavior and performance. In order to estimate the causal effects, we employ different Propensity Score Matching procedures. Results indicate that participating in a program increases firms' internal R&D and innovation effort, the qualification of the workforce, the likelihood of introducing product, process and organizational innovations and the probability of establishing linkages with research partners. However, participants do not show greater external R&D intensity or a higher propensity to patent, nor are they more likely to cooperate with suppliers, customer or competitors. 2016 Informa UK Limited, trading as Taylor & Francis Group.";"Emerging innovation systems and Impact assessment and Innovation support programs and Technological capabilities";"";"JOUR";"Fernndez-Sastre, J. and Martn-Mayoral, F.";"";"Innovation Management, Policy and Practice";"2015";"17";"4";"466";"484";"10.1080/14479338.2016.1157447";"English";"../../data/raw_data/scopus_propensity_to_patent.ris"
"117";"Krishna_2015_InJoofInPrMa";"Managing patents is a core issue in the intellectual property management (IPM) of the firms. It entails two important activities the patenting of new innovations and the renewal of patents. With the research on renewal data gaining momentum, this paper tries to study the renewal of patents in the pharma sector in India. Adopting a unique approach of studying both active and ceased patents of non-resident applicants in India, with the aid of descriptive methods and statistical tools as SPSS following trends, has been found. Business firms are the dominant patentees and single inventorship an emerging trend in India. While renewal patterns are quite applicant category specific, grant period is independent of the applicant category. In case of the patents category (ceased or active), maintenance duration is independent of the number of inventors but effective life of the patents varies with category of patents. The higher propensity to patent and maintenance show linkage with specific technology fields and the portfolio size. Copyright 2015 Inderscience Enterprises Ltd. Active patents and Ceased patents and India and International patent class and Maintenance of patents and Non-resident applicants and Patent data and Strategic management";"A study of the maintenance of patents by the non-residents in India Insights for strategic management of patents";"Managing patents is a core issue in the intellectual property management (IPM) of the firms. It entails two important activities the patenting of new innovations and the renewal of patents. With the research on renewal data gaining momentum, this paper tries to study the renewal of patents in the pharma sector in India. Adopting a unique approach of studying both active and ceased patents of non-resident applicants in India, with the aid of descriptive methods and statistical tools as SPSS following trends, has been found. Business firms are the dominant patentees and single inventorship an emerging trend in India. While renewal patterns are quite applicant category specific, grant period is independent of the applicant category. In case of the patents category (ceased or active), maintenance duration is independent of the number of inventors but effective life of the patents varies with category of patents. The higher propensity to patent and maintenance show linkage with specific technology fields and the portfolio size. Copyright 2015 Inderscience Enterprises Ltd.";"Active patents and Ceased patents and India and International patent class and Maintenance of patents and Non-resident applicants and Patent data and Strategic management";"";"JOUR";"Krishna, V. and Jain, S.K.";"";"International Journal of Intellectual Property Management";"2015";"8";"3-4";"227";"248";"10.1504/IJIPM.2015.076547";"English";"../../data/raw_data/scopus_propensity_to_patent.ris"
"120";"Beaudry_2014_InJoofBi";"Using the four biotechnology uses and development surveys of Statistics Canada, we analyse the importance of collaboration, funding and support, as well as contracting, R&D and IP strategies on the propensity to patent of Canadian biotechnology firms. Our model accounts for the potential endogeneity due to the simultaneity of some of these strategies. Controlling for various firm characteristics, the stage of development of the firm and the sources of its revenues, we find that collaboration with other firms does matter for patenting, as well as R&D, even when controlling for potential endogeneity. IP strategies and contracting out activities also increase the propensity of a firm to patent, and so does angel and venture capital funding. 2014 Inderscience Enterprises Ltd. Biotechnology and Collaboration and Funding and Innovation and Patents and R&D and Biotechnology and Innovation and Investments and Patents and inventions and Biotechnology firms and Collaboration and Endogeneity and Funding and IP strategies and Patents and Venture capital funding and Industry and biotechnology and capital provision and financial provision and industrial practice and innovation and intellectual property rights and legal rights and research and development and article and biotechnology and biotechnology firm and Canada and clinical research and cooperation and employee and endogenous variable and funding and human and leasing and licensing and management and marketing and organization and patent and product development and questionnaire and scientist and Canada";"Impact of collaboration and funding on the propensity to patent of Canadian biotechnology firms 1999-2005";"Using the four biotechnology uses and development surveys of Statistics Canada, we analyse the importance of collaboration, funding and support, as well as contracting, R&D and IP strategies on the propensity to patent of Canadian biotechnology firms. Our model accounts for the potential endogeneity due to the simultaneity of some of these strategies. Controlling for various firm characteristics, the stage of development of the firm and the sources of its revenues, we find that collaboration with other firms does matter for patenting, as well as R&D, even when controlling for potential endogeneity. IP strategies and contracting out activities also increase the propensity of a firm to patent, and so does angel and venture capital funding. 2014 Inderscience Enterprises Ltd.";"Biotechnology and Collaboration and Funding and Innovation and Patents and R&D and Biotechnology and Innovation and Investments and Patents and inventions and Biotechnology firms and Collaboration and Endogeneity and Funding and IP strategies and Patents and Venture capital funding and Industry and biotechnology and capital provision and financial provision and industrial practice and innovation and intellectual property rights and legal rights and research and development and article and biotechnology and biotechnology firm and Canada and clinical research and cooperation and employee and endogenous variable and funding and human and leasing and licensing and management and marketing and organization and patent and product development and questionnaire and scientist and Canada";"";"JOUR";"Beaudry, C.";"";"International Journal of Biotechnology";"2014";"13";"1-3";"22";"52";"10.1504/IJBT.2014.059646";"English";"../../data/raw_data/scopus_propensity_to_patent.ris"
"122";"Bloch_2014_WoReofScTeanSuDe";"This paper examines the role of public and private R&D spillovers and other determinants on the propensity to patent (whether firms engage in patenting activity) and patenting output (the number of patent applications). Knowledge spillovers are constructed based on the research profiles of businesses and public research institutions, respectively. We find that both private and public spillovers have an impact on patenting behaviour, though in opposite directions. Spillovers from business R&D have a negative impact, potentially reflecting adverse effects of rival firms' R&D on expected returns of own patenting activity. In contrast, public spillovers are found to have a positive effect on patenting activity, possibly reflecting the value to firms' patenting activity of basic and applied research conducted by public research institutes. Copyright 2014 Inderscience Enterprises Ltd. Absorptive capacity and Patents and Public and private spillovers and R&D";"Patenting and the role of knowledge spillovers";"This paper examines the role of public and private R&D spillovers and other determinants on the propensity to patent (whether firms engage in patenting activity) and patenting output (the number of patent applications). Knowledge spillovers are constructed based on the research profiles of businesses and public research institutions, respectively. We find that both private and public spillovers have an impact on patenting behaviour, though in opposite directions. Spillovers from business R&D have a negative impact, potentially reflecting adverse effects of rival firms' R&D on expected returns of own patenting activity. In contrast, public spillovers are found to have a positive effect on patenting activity, possibly reflecting the value to firms' patenting activity of basic and applied research conducted by public research institutes. Copyright 2014 Inderscience Enterprises Ltd.";"Absorptive capacity and Patents and Public and private spillovers and R&D";"";"JOUR";"Bloch, C. and Marino, M.";"";"World Review of Science, Technology and Sustainable Development";"2014";"11";"3-4";"219";"236";"10.1504/WRSTSD.2014.066797";"English";"../../data/raw_data/scopus_propensity_to_patent.ris"
"123";"Prez.Cano_2013_E.EMJ";"This article provides a decision framework on the practice of engineering management regarding protection of product and process innovation through patents. It studies the influence that the innovation effort of a company and degree of codification of the innovations has on the propensity to patent. Additionally, we analyze how the sector that the company is engaged in and the type of innovation affect these relationships. The conclusions indicate that both the innovation effort of a company and the degree of codification of the innovations have a positive influence on this propensity, and that this influence is greater in some sectors of activity and also is greater for product and radical innovations. 2013 by the American Society for Engineering Management. Appropriability and Innovation and Knowledge Protection and Patents and R&D Management and Engineering and Innovation and Management and Appropriability and Decision framework and Engineering management and Knowledge protection and Patents and Process Innovation and Radical innovation and Patents and inventions";"Factors that influence the propensity to patent";"This article provides a decision framework on the practice of engineering management regarding protection of product and process innovation through patents. It studies the influence that the innovation effort of a company and degree of codification of the innovations has on the propensity to patent. Additionally, we analyze how the sector that the company is engaged in and the type of innovation affect these relationships. The conclusions indicate that both the innovation effort of a company and the degree of codification of the innovations have a positive influence on this propensity, and that this influence is greater in some sectors of activity and also is greater for product and radical innovations. 2013 by the American Society for Engineering Management.";"Appropriability and Innovation and Knowledge Protection and Patents and R&D Management and Engineering and Innovation and Management and Appropriability and Decision framework and Engineering management and Knowledge protection and Patents and Process Innovation and Radical innovation and Patents and inventions";"";"JOUR";"Prez-Cano, C. and Villn-Altamirano, J.";"";"EMJ - Engineering Management Journal";"2013";"25";"3";"27";"38";"10.1080/10429247.2013.11431980";"English";"../../data/raw_data/scopus_propensity_to_patent.ris"
"124";"Heger_2013_OxfoEconPape";"This article explores whether the heterogeneous costs of disclosure induced by patenting can serve as an explanation for the empirically observed heterogeneity of the propensity to patent across firms. A theoretical model identifies the interplay between market entry barriers and the usefulness of the information disclosed through patenting for competitors as a crucial factor driving the extent of disclosure costs that a patenting firm faces. High costs of disclosure may outweigh the merits of patenting, leading innovators to rely on alternative protection strategies, such as secrecy. An empirical investigation using the German part of the CIS data provides evidence for these theoretical predictions. Oxford University Press 2013. All rights reserved. information and intellectual property rights and market and modeling and theoretical study";"The heterogeneous costs of disclosure and the propensity to patent";"This article explores whether the heterogeneous costs of disclosure induced by patenting can serve as an explanation for the empirically observed heterogeneity of the propensity to patent across firms. A theoretical model identifies the interplay between market entry barriers and the usefulness of the information disclosed through patenting for competitors as a crucial factor driving the extent of disclosure costs that a patenting firm faces. High costs of disclosure may outweigh the merits of patenting, leading innovators to rely on alternative protection strategies, such as secrecy. An empirical investigation using the German part of the CIS data provides evidence for these theoretical predictions. Oxford University Press 2013. All rights reserved.";"information and intellectual property rights and market and modeling and theoretical study";"";"JOUR";"Heger, D. and Zabyy, A.K.";"";"Oxford Economic Papers";"2013";"65";"3";NA;NA;"10.1093/oep/gpt018";"English";"../../data/raw_data/scopus_propensity_to_patent.ris"
"125";"Nuvolari_2013_BusiHistRevi";"This article examines the relationship between patents, appropriability strategies, and market for technology in the English brewing industry before 1850. Previous research has pointed to the apparent paradox that large-scale brewing in this period showed both a self-aware culture of rapid technological innovation and a remarkably low propensity to patent. Our study records how brewery innovators pursued a wide variety of highly distinct appropriability strategies, including secrecy, selective revealing, open innovation and knowledge-sharing for reputational reasons, and patenting. All these strategies could co-exist, although some brewery insiders maintained a suspicion of the promoters of patent technologies, which faded only in the nineteenth century. Furthermore, we find evidence that sophisticated strategies of selective revealing could support trade in inventions even without the use of the patent system. 2013 The President and Fellows of Harvard College. NA";"Inventors, patents, and inventive activities in the english brewing industry, 1634-1850";"This article examines the relationship between patents, appropriability strategies, and market for technology in the English brewing industry before 1850. Previous research has pointed to the apparent paradox that large-scale brewing in this period showed both a self-aware culture of rapid technological innovation and a remarkably low propensity to patent. Our study records how brewery innovators pursued a wide variety of highly distinct appropriability strategies, including secrecy, selective revealing, open innovation and knowledge-sharing for reputational reasons, and patenting. All these strategies could co-exist, although some brewery insiders maintained a suspicion of the promoters of patent technologies, which faded only in the nineteenth century. Furthermore, we find evidence that sophisticated strategies of selective revealing could support trade in inventions even without the use of the patent system. 2013 The President and Fellows of Harvard College.";NA;"";"JOUR";"Nuvolari, A. and Sumner, J.";"";"Business History Review";"2013";"87";"1";"120";"95";"10.1017/S0007680513000159";"English";"../../data/raw_data/scopus_propensity_to_patent.ris"
"126";"Beaudry_2013_IndandInn";"We investigated the factors influencing an academic's propensity to patent and the quality of patenting in nanotechnology and biotechnology. We found that a university researcher is more likely to be listed as an inventor of a patented innovation, regardless of the assignee, if he receives private funding, has a fairly high level of cliquishness in the scientific network and has shown a prior capacity to successfully collaborate with industry, a concept that we named innovation loops. Furthermore, citation rate and number of claims, which are used to represent patent quality, are influenced by factors similar to those explaining patent quantity. 2013 Copyright Taylor and Francis Group, LLC. biotechnology and industrial contracts and Innovation networks and nanotechnology and patents and university-industry collaboration and biotechnology and innovation and nanotechnology and university sector";"Follow the (Industry) Money - The Impact of Science Networks and Industry-to-University Contracts on Academic Patenting in Nanotechnology and Biotechnology";"We investigated the factors influencing an academic's propensity to patent and the quality of patenting in nanotechnology and biotechnology. We found that a university researcher is more likely to be listed as an inventor of a patented innovation, regardless of the assignee, if he receives private funding, has a fairly high level of cliquishness in the scientific network and has shown a prior capacity to successfully collaborate with industry, a concept that we named innovation loops. Furthermore, citation rate and number of claims, which are used to represent patent quality, are influenced by factors similar to those explaining patent quantity. 2013 Copyright Taylor and Francis Group, LLC.";"biotechnology and industrial contracts and Innovation networks and nanotechnology and patents and university-industry collaboration and biotechnology and innovation and nanotechnology and university sector";"";"JOUR";"Beaudry, C. and Kananian, R.";"";"Industry and Innovation";"2013";"20";"3";"241";"260";"10.1080/13662716.2013.791125";"English";"../../data/raw_data/scopus_propensity_to_patent.ris"
"130";"Granstrand_2012_InJoofInPrMa";"Fluctuations in patenting frequency and propensity to patent have caught increasing interest, not the least since the emergence of a worldwide pro-patent era. In this paper, fluctuations in Swedish patent frequency are described and analysed, based on statistics and questionnaire survey studies among large and small patentees as well as among IP consultancy firms, complemented with interviews. The results confirm the importance of size of R&D and size of patenting resources for both large and small firms and for both positive and negative growth of patenting. In addition, some new determinants were found, of which some also discriminated between large and small firms. A shift to more quality-oriented patenting strategies with more selective patenting led to decreased patenting propensity and frequency, especially among large firms. As to propensity to patent using different routes, national first filings are declining in the longer run on average for small countries like Sweden and Finland, as especially large companies internationalise their IP operations and increasingly use the PCT route. Copyright 2012 Inderscience Enterprises Ltd. Appropriation and Frequency and Innovation and Intellectual property right and Management and Patent and Policy and Propensity and Strategy and Sweden";"The anatomy of rise and fall of patenting and propensity to patent The case of Sweden";"Fluctuations in patenting frequency and propensity to patent have caught increasing interest, not the least since the emergence of a worldwide pro-patent era. In this paper, fluctuations in Swedish patent frequency are described and analysed, based on statistics and questionnaire survey studies among large and small patentees as well as among IP consultancy firms, complemented with interviews. The results confirm the importance of size of R&D and size of patenting resources for both large and small firms and for both positive and negative growth of patenting. In addition, some new determinants were found, of which some also discriminated between large and small firms. A shift to more quality-oriented patenting strategies with more selective patenting led to decreased patenting propensity and frequency, especially among large firms. As to propensity to patent using different routes, national first filings are declining in the longer run on average for small countries like Sweden and Finland, as especially large companies internationalise their IP operations and increasingly use the PCT route. Copyright 2012 Inderscience Enterprises Ltd.";"Appropriation and Frequency and Innovation and Intellectual property right and Management and Patent and Policy and Propensity and Strategy and Sweden";"";"JOUR";"Granstrand, O. and Holgersson, M.";"";"International Journal of Intellectual Property Management";"2012";"5";"2";"169";"198";"10.1504/IJIPM.2012.047503";"English";"../../data/raw_data/scopus_propensity_to_patent.ris"
"131";"de.Rassenfosse_2012_OxBuofEcanSt";"This paper provides an analysis of the impact of patent fees on the demand for patents. It presents a dataset of fees since 1980 at the European (EPO), the US and the Japanese patent offices. Descriptive statistics show that fees have severely decreased at the EPO over the 1990s, converging towards the level of fees in the US and Japan. The estimation of dynamic panel data models suggests that the price elasticity of demand for patents is about -0.30. These results suggest that the laxity of fee policy at the EPO has significantly contributed to the rising propensity to patent. Blackwell Publishing Ltd and the Department of Economics, University of Oxford, 2011. NA";"On the price elasticity of demand for patents";"This paper provides an analysis of the impact of patent fees on the demand for patents. It presents a dataset of fees since 1980 at the European (EPO), the US and the Japanese patent offices. Descriptive statistics show that fees have severely decreased at the EPO over the 1990s, converging towards the level of fees in the US and Japan. The estimation of dynamic panel data models suggests that the price elasticity of demand for patents is about -0.30. These results suggest that the laxity of fee policy at the EPO has significantly contributed to the rising propensity to patent. Blackwell Publishing Ltd and the Department of Economics, University of Oxford, 2011.";NA;"";"JOUR";"de Rassenfosse, G. and van Pottelsberghe de La Potterie, B.";"";"Oxford Bulletin of Economics and Statistics";"2012";"74";"1";"58";"77";"10.1111/j.1468-0084.2011.00638.x";"English";"../../data/raw_data/scopus_propensity_to_patent.ris"
